<!ENTITY % s "series">
<!ENTITY % r "region">
<!ENTITY % p "(MEX|USA|ESP|ARG|KOR) #REQUIRED">
<!ELEMENT CatalogoVOD (cuenta+, contenido)>
<!ELEMENT cuenta (perfiles)>
<!ELEMENT perfiles (perfil+)>
<!ELEMENT perfil (#PCDATA)>
<!ELEMENT contenido (peliculas+, %s;+)>
<!ELEMENT peliculas (genero+)>
<!ELEMENT %s; (genero+)>
<!ELEMENT genero (titulo+)>
<!ELEMENT titulo (nombre)>
<!ELEMENT nombre (#PCDATA)>
<!ATTLIST cuenta 
correo CDATA #REQUIRED>
<!ATTLIST perfil 
usuario CDATA #REQUIRED
idioma CDATA #REQUIRED>
<!ATTLIST %s; 
%r; %p;>
<!ATTLIST peliculas
%r; %p;> 
<!ATTLIST genero 
nombre CDATA #REQUIRED>
<!ATTLIST titulo 
duracion CDATA #REQUIRED>